{
  "annual_id": "MOS-MUSIC-ANNUAL-2027",
  "year": 2027,
  "week_id": "2027-W04",
  "mos_week": "W04",
  "sermon_week_ref": "mos-sermon-2027｜W04 路5:27–32「跟随，就走近人」（52周正式释经生产版 V2.0）",
  "bible_passage_id": "路5:27–32",
  "bible_reference_ids": [
    "BB-LUK-5"
  ],
  "core_truth": {
    "text": "耶稣来，是寻找并呼召罪人悔改；祂主动进入罪人的场所，跟随祂的人因此被带进祂寻找罪人的工作里。",
    "provenance": {
      "source_system": "mos-sermon-2027",
      "source_id": "W04",
      "source_field": "⑥ 经文中心",
      "copy_policy": "reference_only",
      "note": "照录 2027 正式释经表经文中心。"
    }
  },
  "life_question_id": "LQ01",
  "music_unit_id": [
    "MM08",
    "MM20"
  ],
  "mm_rationale": "经文有两个动作：「你跟从我来」（呼召）与「一同坐席」（同席）。前者正是 MM08 跟随基督的定义（跟随始于认识祂是谁），后者是 MM20 爱邻舍的方向（走近并服事具体的邻舍）。W04 的独特分工不是「撇下」（那是 W03 的路5:1–11），而是「被召的人立刻进入召他者的工作」。同时，法利赛人以「与谁同席」界定自己是谁，耶稣却以「医生与病人」重新定义身份——正面回应 LQ01「我是谁？」，身份不由圈层与表现决定，而在蒙召的恩典里。",
  "music_function": [
    "TR",
    "CO",
    "LI"
  ],
  "core_song_id": "MUS-S-0001",
  "auxiliary_song_id": [],
  "seven_step_practice": {
    "S1_read": {
      "label": "读",
      "prompt": "阅读或聆听本周经文，先不急着应用。",
      "content": "读路5:27–32：分四步读——①耶稣出去，「看见」一个税吏名叫利未，对他说「你跟从我来」；②利未就撇下所有的，起来跟从了耶稣；③利未在自己家里为耶稣大摆筵席，同席的「有许多税吏和别的罪人」；④法利赛人与文士发怨言，耶稣回答「无病的人用不着医生……我来本不是召义人悔改，乃是召罪人悔改」。",
      "content_status": "reviewed"
    },
    "S2_understand": {
      "label": "明",
      "prompt": "这段经文究竟教导什么？",
      "content": "耶稣的「看见」是主动的寻找与拣选，不看人的资格——利未是当时被宗教群体排除的税吏。被恩典得着的人第一件事不是把自己藏起来，而是把主带进自己的圈子（设筵席）。同席之争的焦点不是吃饭，而是「谁配被接纳」：自义使人以距离为圣洁，并替神决定谁能坐席。耶稣用「医生与病人」定义自己的使命——走近不等于认同罪，也不取消悔改（5:32 同时说「召罪人」与「悔改」）。",
      "content_status": "reviewed"
    },
    "S3_sing": {
      "label": "唱",
      "prompt": "通过歌曲表达已经理解的真理。",
      "content": "唱《奇异恩典》第一、二节（歌词见教会诗本或授权来源）：把自己放进「前我失丧，今被寻回」的第一人称里——这正是利未所经历的。唱之前先问一句：如果我是那个坐在税关上的人，我会被邀请坐席吗？唱完之后再问一句：今天还有谁没有被邀请？",
      "content_status": "reviewed"
    },
    "S4_remember": {
      "label": "记",
      "prompt": "本周希望门徒记住什么？",
      "content": "记住一句话：「我是需要医生的病人，别人也是。」（对应经文：路5:31–32）",
      "content_status": "reviewed"
    },
    "S5_feel": {
      "label": "感",
      "prompt": "真理应该形成怎样的情感回应？",
      "content": "让真理塑造的情感是：对自己蒙恩的谦卑（我原是被寻回的罪人）与对被排斥者的怜悯。警惕两种假情感：一是把「唱得很感动」当作已经接纳了人；二是用「我们都是罪人」的空话，掩盖自己其实仍不想坐到那个人旁边。",
      "content_status": "reviewed"
    },
    "S6_act": {
      "label": "行",
      "prompt": "本周要完成的一个具体行动。",
      "content": "本周主动走近一位「平时被群体忽略、或你自己不想主动靠近」的具体的人：向一位曾因离婚、成瘾、财务失败、服刑经历被隐性边缘的弟兄姊妹（或不与你同背景、同圈层的人）发出一次具体邀请——约他吃饭或喝茶，或本周坐到他旁边认真聆听三十分钟，并明确说一句「我们欢迎你」。本周内完成，写下对象名字与完成时间；不先问「别人怎么看」，先问「基督会走近谁」；下周在小组或伙伴面前报告完成情况。",
      "content_status": "reviewed"
    },
    "S7_transmit": {
      "label": "传",
      "prompt": "本周要把什么传给别人？",
      "content": "本周带一位肢体（或家人）走一遍七步法，就用本周的路5:27–32与《奇异恩典》。不要只讲道理，一起回答一句「这一周我要走近谁？」。下周见面时互相回报：他走近了谁、你走近了谁、结果如何。",
      "content_status": "reviewed"
    }
  },
  "life_practice": "本周向一位被忽略或被隐性边缘的人作一次具体走近（约餐、换座或聆听三十分钟），并明确说一句「我们欢迎你」，完成时间写下来。",
  "transmission_task": "带一位肢体或家人走一遍七步法（本周经文与歌曲），下周互相回报各自走近了谁、结果如何。",
  "expected_formation": "从「我与谁划清界限」的身份感转向「我是被召的罪人」；出现至少一次可查验的走近行动，并用七步法带人走一遍。",
  "status": "reviewed",
  "provenance": {
    "source_system": "mos-sermon-2027",
    "source_id": "2027-W04",
    "source_field": "W04 全行",
    "copy_policy": "reference_only",
    "note": "周样本为音乐门训层。"
  }
}
